Chamado de 1º nível,Fechado,RNP2024-026782,CERT.br,[certbr-anuncios] 5º Workshop MISP -- Chamada de Palestras,False,2024-02-16 16:22:00,,Clientes,Incidente,Fechado,POP::RS::CERT-RS,True,True,,Segurança,CSIRT,,False,,POP::RS::CERT-RS,,"16/02/2024 15:52 CERT.br: Data de envio: Feb 16, 2024 3:48 PM Para: email-anon-00f3529c CC: email-anon-83824c64 Assunto: [certbr-anuncios] 5º Workshop MISP -- Chamada de Palestras 5º Workshop MISP -- Chamada de Palestras https://forum.cert.br/#cfp-misp Convidamos todos os profissionais que trabalhem com MISP, seja na manutenção de instâncias ou no uso dos dados compartilhados em seu dia a dia, a submeter propostas de palestras para o 5º Workshop MISP, que ocorrerá no dia 31 de julho de 2024, no WTC Events Center, em São Paulo/SP. Para cada proposta aceita, o NIC.br proverá apoio para transporte e estadia de um profissional para apresentá-la. Temas de Interesse A apresentação deve tratar de aspectos práticos e operacionais relacionados com uso e operação da Plataforma MISP. Uma lista não exaustiva de temas de interesse para este evento segue: * Estudos de caso de uso do MISP para proteção de infraestrutura, gestão de vulnerabilidades, Threat hunting, tratamento de incidentes e áreas correlatas * Uso da plataforma de forma automatizada, por exemplo via PyMISP * Integração do MISP com outras soluções * Outros assuntos de interesse da comunidade de usuários de MISP Importante: é desejável que as apresentações sejam aplicadas e práticas, e *não* devem ser voltadas a produtos e soluções de fornecedores específicos, com fins comerciais, nem trabalhos que sejam com ênfase puramente acadêmica. Submissão de Propostas As propostas de palestras deverão ser enviadas para o e-mail email-anon-8b310a00 com os seguintes dados: * ""[MISP]"" no início do Subject. * Título completo. * Resumo (Abstract) estendido, rascunho dos slides ou descrição detalhada, o importante é que seja possível avaliar o conteúdo e a abordagem. O comitê avaliador de trabalhos poderá, a seu critério, solicitar informações adicionais ou complementares. * Nome completo, endereço de e-mail, mini CV e organização a que pertence cada um dos autores. * TLP da palestra (pode ser misto, por exemplo: TLP:CLEAR com partes TLP:AMBER+STRICT). Veja aqui detalhes sobre uso de TLP no evento: https://forum.cert.br/#tlp Datas Importantes * 29 de abril de 2024 Prazo para envio de [24]propostas de palestra * 30 de maio de 2024 Divulgação da agenda e abertura das inscrições * 31 de julho de 2024 5º Workshop MISP Atenciosamente, -- CERT.br/NIC.br <email-anon-83824c64> https://cert.br/ _______________________________________________ certbr-anuncios mailing list email-anon-00f3529c https://listas.cert.br/mailman/listinfo/certbr-anuncios",16/02/2024 16:50 Felipe Muller: info! 16/02/2024 15:53 Ipezinho Bot: Endereço direto para o chamado: Para Operadores: https://atendimento.rnp.br/tas/secure/contained/incident?unid=7e5c361a-51a5-4c14-9151-9a4fbcd8402c Para Cliente: https://atendimento.rnp.br/tas/public/contained/incidentpublic?unid=7e5c361a-51a5-4c14-9151-9a4fbcd8402c,16/02/2024 15:53 email-anon-1d555801: <img src='/icons/progresstrail.mail/16' style='vertical-align: text-bottom' width='16' alt='E-mails enviados'></img> 00. Registro - Notifica&ccedil;&atilde;o ao Solicitante 16/02/2024 15:53 email-anon-1d555801: <img src='/icons/progresstrail.mail/16' style='vertical-align: text-bottom' width='16' alt='E-mails enviados'></img> Notificação de Fila - Novo Chamado,"<iframe width=""100%"" height=""100%"" style=""border: 0;"" src='/services/affiliation-frontend-v1/#/incidentMemofield?id=7e5c361a-51a5-4c14-9151-9a4fbcd8402c&lang=pt-BR'></iframe>"
Chamado de 1º nível,Fechado,RNP2024-028538,CERT.br,Alerta: [AS 2716] servidor DNS recursivo aberto,False,2024-02-20 12:03:00,,Clientes,Incidente,Fechado,POP::RS::CERT-RS,True,True,,Segurança,CSIRT,,False,,POP::RS::CERT-RS,,"20/02/2024 11:33 CERT.br: Data de envio: Feb 20, 2024 11:31 AM Para: email-anon-f6f70863, email-anon-a0a85d70 CC: email-anon-83824c64 Assunto: Alerta: [AS 2716] servidor DNS recursivo aberto Caro responsável, Os IPs presentes no log abaixo são servidores DNS recursivos abertos (53/udp) sob sua responsabilidade. Estes servidores podem ser abusados para fazer parte de ataques distribuídos de negação de serviço, consumindo recursos da sua rede e impactando terceiros. Lembramos que os endereços IP listados também podem ser de dispositivos de rede com funcionalidade de resolução de nomes, como roteadores e CPEs (modem ou roteador de uso doméstico instalado nos clientes), entre outros. Gostaríamos de solicitar que: * Os servidories DNS listados sejam configurados de modo a corrigir este problema. Uma descrição do problema e possíveis soluções podem ser encontradas em: https://cert.br/docs/whitepapers/dns-recursivo-aberto/ ==================================================================================== Endereco IP | ASN | Status | Data do Teste | Resultados do Teste ipv4-anon-638a92e7 | 2716 | OPEN | 2024-02-20T13:56:30Z | dns: open/1/0/0 ==================================================================================== Os indicadores no campo 'Resultados dos Testes' significam: * ancount: número de registros na seção de resposta do pacote DNS; * nscount: número de registros na seção de reposta autoritativa; * arcount: número de registros na seção adicional de resposta; * ra: recursividade: 1=ativada, 0=desativada; * rcode: status da query DNS. Se você não for a pessoa correta para corrigir o problema deste servidor DNS recursivo aberto, por favor repasse essa mensagem para alguém de sua organização que possa fazê-lo. Mais detalhes sobre o porque do envio desta mensagem, quem é o CERT.br e como resolver este problema estão listados abaixo. Cordialmente, -- CERT.br <email-anon-83824c64> https://cert.br/ * O que é um servidor DNS recursivo aberto? Um servidor DNS recursivo é considerado aberto quando aceita consultas recursivas de modo indiscriminado, de qualquer rede. * Por que devo me preocupar com isso? Um servidor DNS recursivo aberto pode ser abusado para causar danos a terceiros, envolvendo sua rede em ataques a outras organizações, além de implicar em um consumo de banda maior. * Onde posso obter informações sobre o problema e como solucioná-lo? - Recomendações para Evitar o Abuso de Servidores DNS Recursivos Abertos https://cert.br/docs/whitepapers/dns-recursivo-aberto/ * Onde aprender mais sobre configuração segura de sistemas? - Práticas de Segurança para Administradores de Redes Internet https://cert.br/docs/seg-adm-redes/ * Por que estou recebendo essa mensagem? Você está recebendo esse email por estar listado em https://registro.br/ como contato desta rede ou domínio. Se você for contato de várias redes diferentes é possível que você receba mais de um email, com conteúdos diferentes. Por favor não apague outras cópias que vier a receber. * Como o CERT.br sabe que este é um servidor recursivo aberto? O CERT.br está recebendo notificações com listas de servidores DNS recursivos abertos que possivelmente estao sendo abusados e utilizados em ataques distribuídos de negação de serviços (DDoS). O CERT.br está notificando os responsáveis pelos servidores brasileiros presentes nestas listas. * Como posso ter certeza que resolvi o problema? Você pode verificar seu servidor através deste site: * https://www.openresolver.nl/ * Quem é o CERT.br? O CERT.br é um Grupo de Resposta a Incidentes de Segurança (CSIRT) Nacional de Último Recurso, mantido pelo NIC.br. O CERT.br auxilia no tratamento de incidentes que envolvam qualquer rede que utilize recursos administrados pelo NIC.br (IP ou ASN alocados ao Brasil e domínios sob o ccTLD .br).",22/02/2024 15:01 Felipe Muller: Chamado sendo tratado RNP2024-028538. 20/02/2024 11:33 Ipezinho Bot: Endereço direto para o chamado: Para Operadores: https://atendimento.rnp.br/tas/secure/contained/incident?unid=a264e0bc-025c-4a74-82e7-fcfa1bf1d4f0 Para Cliente: https://atendimento.rnp.br/tas/public/contained/incidentpublic?unid=a264e0bc-025c-4a74-82e7-fcfa1bf1d4f0,20/02/2024 11:33 email-anon-1d555801: <img src='/icons/progresstrail.mail/16' style='vertical-align: text-bottom' width='16' alt='E-mails enviados'></img> 00. Registro - Notifica&ccedil;&atilde;o ao Solicitante 20/02/2024 11:33 email-anon-1d555801: <img src='/icons/progresstrail.mail/16' style='vertical-align: text-bottom' width='16' alt='E-mails enviados'></img> Notificação de Fila - Novo Chamado,"<iframe width=""100%"" height=""100%"" style=""border: 0;"" src='/services/affiliation-frontend-v1/#/incidentMemofield?id=a264e0bc-025c-4a74-82e7-fcfa1bf1d4f0&lang=pt-BR'></iframe>"
Chamado de 1º nível,Fechado,RNP2024-033701,CERT.br,Alerta: [AS 2716] servidor NTP mal configurado,False,2024-03-01 14:35:00,,Clientes,Incidente,Fechado,POP::RS::CERT-RS,True,True,,Segurança,CSIRT,,False,,POP::RS::CERT-RS,,"01/03/2024 14:05 CERT.br: Data de envio: Mar 1, 2024 2:04 PM Para: email-anon-f6f70863, email-anon-a0a85d70 CC: email-anon-83824c64 Assunto: Alerta: [AS 2716] servidor NTP mal configurado Caro responsável, Os IPs presentes no log abaixo são servidores NTP mal configurados sob sua responsabilidade (123/udp). Estes servidores podem ser abusados para fazer parte de ataques distribuídos de negação de serviço, consumindo recursos da sua rede e impactando terceiros. Lembramos que os endereços IP listados também podem ser dispositivos de rede com funcionalidade NTP, como roteadores e CPEs (modem ou roteador de uso doméstico instalado nos clientes). Gostaríamos de solicitar que: * Os servidores NTP listados sejam configurados de modo a corrigir este problema. Uma descrição do problema e possíveis soluções podem ser encontradas no final deste documento. Se você não for a pessoa correta para corrigir o problema destes servidores NTP mal configurados, por favor repasse essa mensagem para alguém de sua organização que possa fazê-lo. Os indicadores no campo 'Resultados do Teste' indicam os tipos de problemas testados e significam: * monlist: status/pacotes/bytes, onde status pode ser ""timeout"", ""open"" ou ""closed"", e pacotes/bytes são o tamanho da resposta recebida, em pacotes/bytes; * readvar: status/pacotes/bytes, onde status pode ser ""timeout"", ""open"" ou ""closed"", e pacotes/bytes sao o tamanho da resposta recebida, em pacotes/bytes; ==================================================================================== Endereco IP | ASN | Status | Data do Teste | Resultados do Teste ipv6-anon-964a228e | 2716 | OPEN | 2024-03-01T16:42:13Z | readvar: open/1/360 ipv6-anon-71395fab | 2716 | OPEN | 2024-03-01T16:42:13Z | readvar: open/1/288 ==================================================================================== Mais detalhes sobre o porque do envio desta mensagem, quem é o CERT.br e como resolver este problema estão listados abaixo. Cordialmente, -- CERT.br <email-anon-83824c64> https://cert.br/ * O que é um servidor NTP mal configurado e passível de amplificação? Um servidor NTP é considerado mal configurado e passível de amplificação quando aceita determinados comandos, como monlist ou readvar, que permitem gerar respostas muito maiores que a pergunta, para origens forjadas. * Por que devo me preocupar com isso? Um servidor NTP mal configurado pode ser abusado para causar danos a terceiros, envolvendo sua rede em ataques a outras organizações, além de implicar em um maior consumo de banda. Informações adicionais sobre como evitar que sua rede seja abusada para este e outros ataques DDoS podem ser econtrados aqui: https://cert.br/docs/whitepapers/ddos/ * Como faço para corrigir o problema em sistemas Unix? 1. Desabilite o comando ""monlist"". Isso pode ser feito de duas maneiras: - Inclua no ntpd.conf a seguinte linha: disable monitor - Instale a versao 4.2.7p26 ou mais atual, que não possui o comando monlist. 2. Desabilite o comando ""readvar"" - Inclua no ntpd.conf as seguintes linhas: restrict default kod notrap nomodify nopeer noquery restrict -6 default kod notrap nomodify nopeer noquery * Onde posso obter informações adicionais sobre configuração segura de servidores NTP? - Guia NTP para Linux/BSD http://www.ntp.br/guia-linux-avancado.php Team Cymru Secure NTP Template (inclui cisco e juniper) - https://github.com/team-cymru/network-security-templates/tree/master/Secure-NTP-Templates * Como o CERT.br sabe que este é um servidor NTP vulnerável? O CERT.br está recebendo notificações com listas de servidores NTP que possivelmente estão sendo abusados e utilizados em ataques distribuídos de negação de serviços (DDoS). O CERT.br está notificando os responsáveis pelos servidores brasileiros presentes nestas listas. * Como posso ter certeza que resolvi o problema? Você pode verificar seu servidor através dos seguintes comandos: (pr",01/03/2024 16:04 Felipe Muller: Resolvido nos equipamentos! 01/03/2024 14:05 Ipezinho Bot: Endereço direto para o chamado: Para Operadores: https://atendimento.rnp.br/tas/secure/contained/incident?unid=7ffb2ceb-fa08-431c-9fa6-986d184dc7bb Para Cliente: https://atendimento.rnp.br/tas/public/contained/incidentpublic?unid=7ffb2ceb-fa08-431c-9fa6-986d184dc7bb,01/03/2024 14:05 email-anon-1d555801: <img src='/icons/progresstrail.mail/16' style='vertical-align: text-bottom' width='16' alt='E-mails enviados'></img> 00. Registro - Notifica&ccedil;&atilde;o ao Solicitante 01/03/2024 14:05 email-anon-1d555801: <img src='/icons/progresstrail.mail/16' style='vertical-align: text-bottom' width='16' alt='E-mails enviados'></img> Notificação de Fila - Novo Chamado,"<iframe width=""100%"" height=""100%"" style=""border: 0;"" src='/services/affiliation-frontend-v1/#/incidentMemofield?id=7ffb2ceb-fa08-431c-9fa6-986d184dc7bb&lang=pt-BR'></iframe>"
Chamado de 1º nível,Fechado,RNP2024-044532,CERT.br,Alerta: Servidor Zimbra Possivelmente Vulneravel,False,2024-03-21 10:19:00,,Clientes,Incidente,Fechado,POP::RS::CERT-RS,True,True,,Segurança,CSIRT,,False,,POP::RS::CERT-RS,,"21/03/2024 09:49 CERT.br: Data de envio: Mar 21, 2024 9:48 AM Para: email-anon-a0a85d70, email-anon-53f32c8d, email-anon-f6f70863 CC: email-anon-83824c64 Assunto: Alerta: Servidor Zimbra Possivelmente Vulneravel Caro responsável, De acordo com informações recebidas de parceiros, os servidores listados abaixo possivelmente estão executando uma versão vulnerável do software Zimbra Collaboration Suite. A vulnerabilidade é descrita pelo CVE-2022-37042 e foi corrigida nas versões 8.8.15 Patch 33 e 9.0.0 Patch 33. Portanto, versões anteriores a essas estão vulneráveis. Essa vunerabilidade permite que um atacante faça upload de arquivos para o servidor e também execute código arbitrário sem autenticação e/ou obtenha acesso não autorizado a contas de usuários do sistema. Essas ações possibilitam, por exemplo, o abuso dessas contas para campanhas de phishing e furto de informações sensíveis. Gostaríamos de solicitar que: * Por favor verifique se o servidor Zimbra está realmente vulnerável. Não realizamos testes para avaliar a veracidade dessas informações; * Em caso afirmativo, atualize o software com os patches mais recentes disponíveis de acordo com as instruções do desenvolvedor; * Verifique se o sistema foi comprometido. Se você não for a pessoa correta para corrigir o problema destes servidores, por favor repasse essa mensagem para alguém de sua organização que possa fazê-lo. Se você for contato de mais de uma rede ou domínio é possível que você receba mais de um email desse tipo, com conteúdos diferentes. Por favor não apague outras notificações que vier a receber. Caso os respectivos patches já tenham sido aplicados, pedimos que por favor desconsidere essa mensagem. ======================================================================================================= IP | Porta | Timestamp (UTC) | Dominio | CVE ipv6-anon-fff0e7e7 | 443 | 2024-03-18T14:15:22Z | mail2.furg.br | cve-2022-37042;zimbra ipv6-anon-fff0e7e7 | 80 | 2024-03-19T14:04:19Z | mail2.furg.br | cve-2022-37042;zimbra ipv6-anon-1d627090 | 443 | 2024-03-19T00:22:09Z | mail1.furg.br | cve-2022-37042;zimbra ======================================================================================================= Mais detalhes sobre o motivo do envio desta mensagem, quem é o CERT.br e como resolver este problema estão listados abaixo. Cordialmente, -- CERT.br/NIC.br <email-anon-83824c64> https://cert.br/ * Como o CERT.br sabe que este endereço IP possui um serviço vulnerável? O CERT.br recebe de parceiros listas contendo informações sobre os IPs com serviços vulneráveis. * Como resolver o problema? Recomendamos que siga as instruções de atualização publicadas pelo desenvolvedor nos URLs abaixo: https://wiki.zimbra.com/wiki/Security_Center https://wiki.zimbra.com/wiki/Zimbra_Security_Advisories * Como faço para determinar se meu servidor foi comprometido? Recomendamos que verifique o sistema e seus logs em busca de processos e arquivos desconhecidos, autenticações e tráfego de rede incomuns. Alguns IoCs (Indicators of Compromise) tem sido publicados sobre esse problema. Os IoCs podem ser encontrados no documento abaixo: https://www.cisa.gov/uscert/ncas/alerts/aa22-228a Esse documento poderá ser atualizado para incluir novos IoCs Caso o seu sistema tenha sido comprometido, será necessário, além das atualizações, a remoção dos arquivos relacionados aos IoCs ou a reinstalação completa do sistema. * Onde posso obter mais informações sobre o problema? Você pode obter mais informações sobre o problema nos URLs abaixo: - CISA Alert (AA22-228A) - Threat Actors Exploiting Multiple CVEs Against Zimbra Collaboration Suite (inclui referências para outras fontes) https://www.cisa.gov/uscert/ncas/alerts/aa22-228a - Mass Exploitation of (Un)authenticated Zimbra RCE: CVE-2022-27925 https://www.volexity.com/blog/2022/08",21/03/2024 09:49 Ipezinho Bot: Endereço direto para o chamado: Para Operadores: https://atendimento.rnp.br/tas/secure/contained/incident?unid=6243f658-f338-4eb9-ac00-189f2789a6a9 Para Cliente: https://atendimento.rnp.br/tas/public/contained/incidentpublic?unid=6243f658-f338-4eb9-ac00-189f2789a6a9,21/03/2024 09:49 email-anon-1d555801: <img src='/icons/progresstrail.mail/16' style='vertical-align: text-bottom' width='16' alt='E-mails enviados'></img> 00. Registro - Notifica&ccedil;&atilde;o ao Solicitante 21/03/2024 09:49 email-anon-1d555801: <img src='/icons/progresstrail.mail/16' style='vertical-align: text-bottom' width='16' alt='E-mails enviados'></img> Notificação de Fila - Novo Chamado,"<iframe width=""100%"" height=""100%"" style=""border: 0;"" src='/services/affiliation-frontend-v1/#/incidentMemofield?id=6243f658-f338-4eb9-ac00-189f2789a6a9&lang=pt-BR'></iframe>"
Chamado de 1º nível,Fechado,RNP2024-044535,CERT.br,Alerta: Servidor Zimbra Possivelmente Vulneravel,False,2024-03-21 10:19:00,,Clientes,Incidente,Fechado,POP::RS::CERT-RS,True,True,,Segurança,CSIRT,,False,,POP::RS::CERT-RS,,"21/03/2024 09:49 CERT.br: Data de envio: Mar 21, 2024 9:48 AM Para: email-anon-a0a85d70, email-anon-f6f70863 CC: email-anon-83824c64 Assunto: Alerta: Servidor Zimbra Possivelmente Vulneravel Caro responsável, De acordo com informações recebidas de parceiros, os servidores listados abaixo possivelmente estão executando uma versão vulnerável do software Zimbra Collaboration Suite. A vulnerabilidade é descrita pelo CVE-2022-37042 e foi corrigida nas versões 8.8.15 Patch 33 e 9.0.0 Patch 33. Portanto, versões anteriores a essas estão vulneráveis. Essa vunerabilidade permite que um atacante faça upload de arquivos para o servidor e também execute código arbitrário sem autenticação e/ou obtenha acesso não autorizado a contas de usuários do sistema. Essas ações possibilitam, por exemplo, o abuso dessas contas para campanhas de phishing e furto de informações sensíveis. Gostaríamos de solicitar que: * Por favor verifique se o servidor Zimbra está realmente vulnerável. Não realizamos testes para avaliar a veracidade dessas informações; * Em caso afirmativo, atualize o software com os patches mais recentes disponíveis de acordo com as instruções do desenvolvedor; * Verifique se o sistema foi comprometido. Se você não for a pessoa correta para corrigir o problema destes servidores, por favor repasse essa mensagem para alguém de sua organização que possa fazê-lo. Se você for contato de mais de uma rede ou domínio é possível que você receba mais de um email desse tipo, com conteúdos diferentes. Por favor não apague outras notificações que vier a receber. Caso os respectivos patches já tenham sido aplicados, pedimos que por favor desconsidere essa mensagem. ======================================================================================================= IP | Porta | Timestamp (UTC) | Dominio | CVE ipv4-anon-03a87af5 | 443 | 2024-03-19T01:55:05Z | mail.softwarelivre.org | cve-2022-37042;zimbra ipv4-anon-03a87af5 | 8080 | 2024-03-19T01:07:51Z | mail.softwarelivre.org | cve-2022-37042;zimbra ipv4-anon-03a87af5 | 80 | 2024-03-19T11:06:01Z | mail.softwarelivre.org | cve-2022-37042;zimbra ======================================================================================================= Mais detalhes sobre o motivo do envio desta mensagem, quem é o CERT.br e como resolver este problema estão listados abaixo. Cordialmente, -- CERT.br/NIC.br <email-anon-83824c64> https://cert.br/ * Como o CERT.br sabe que este endereço IP possui um serviço vulnerável? O CERT.br recebe de parceiros listas contendo informações sobre os IPs com serviços vulneráveis. * Como resolver o problema? Recomendamos que siga as instruções de atualização publicadas pelo desenvolvedor nos URLs abaixo: https://wiki.zimbra.com/wiki/Security_Center https://wiki.zimbra.com/wiki/Zimbra_Security_Advisories * Como faço para determinar se meu servidor foi comprometido? Recomendamos que verifique o sistema e seus logs em busca de processos e arquivos desconhecidos, autenticações e tráfego de rede incomuns. Alguns IoCs (Indicators of Compromise) tem sido publicados sobre esse problema. Os IoCs podem ser encontrados no documento abaixo: https://www.cisa.gov/uscert/ncas/alerts/aa22-228a Esse documento poderá ser atualizado para incluir novos IoCs Caso o seu sistema tenha sido comprometido, será necessário, além das atualizações, a remoção dos arquivos relacionados aos IoCs ou a reinstalação completa do sistema. * Onde posso obter mais informações sobre o problema? Você pode obter mais informações sobre o problema nos URLs abaixo: - CISA Alert (AA22-228A) - Threat Actors Exploiting Multiple CVEs Against Zimbra Collaboration Suite (inclui referências para outras fontes) https://www.cisa.gov/uscert/ncas/alerts/aa22-228a - Mass Exploitation of (Un)authenticated Zimbra RCE: CVE-2022-27925 https://www.volexity.com/blog/2022/08/10/mass-exploitation-of-unauthenticated-zimbr",21/03/2024 09:49 Ipezinho Bot: Endereço direto para o chamado: Para Operadores: https://atendimento.rnp.br/tas/secure/contained/incident?unid=ebceffec-0aa2-4048-b844-6227ed444027 Para Cliente: https://atendimento.rnp.br/tas/public/contained/incidentpublic?unid=ebceffec-0aa2-4048-b844-6227ed444027,21/03/2024 09:49 email-anon-1d555801: <img src='/icons/progresstrail.mail/16' style='vertical-align: text-bottom' width='16' alt='E-mails enviados'></img> 00. Registro - Notifica&ccedil;&atilde;o ao Solicitante 21/03/2024 09:49 email-anon-1d555801: <img src='/icons/progresstrail.mail/16' style='vertical-align: text-bottom' width='16' alt='E-mails enviados'></img> Notificação de Fila - Novo Chamado,"<iframe width=""100%"" height=""100%"" style=""border: 0;"" src='/services/affiliation-frontend-v1/#/incidentMemofield?id=ebceffec-0aa2-4048-b844-6227ed444027&lang=pt-BR'></iframe>"
