Nível,Andamento,Número do chamado,Nome do solicitante,Breve descrição (Detalhes),É um chamado principal,Data alvo,Data alvo de resposta,'Organização' (Solicitante),Tipo de chamado,Status,Operador,Resolvido(a)s,Fechado(a)s,Impacto,Categoria,Subcategoria,Data alvo do SLA,Respondido,Data de resposta,Grupo de operadores,Operador do escalonamento/rebaixamento,Pedido,Ação,Anexos,Chamados similares
Chamado de 1º nível,Fechado,RNP2021-036715,CERT.br,[certbr-anuncios] Cursos CERT.br: Agenda 2021,False,2021-06-30 16:40:00,,Clientes,Incidente,Fechado,POP::RS::CERT-RS,True,True,,Segurança,CSIRT,,False,,POP::RS::CERT-RS,,"30/06/2021 16:10 CERT.br: Data de envio: Jun 30, 2021 4:07 PM Para: email-anon-00f3529c Assunto: [certbr-anuncios] Cursos CERT.br: Agenda 2021 No ano de 2021 será ministrado somente o curso Fundamentals of Incident Handling (FIH). As turmas oferecidas do FIH serão: Turma 1: 25 a 29 de outubro de 2021 Turma 2: 22 a 26 de novembro de 2021 Informações adicionais: Abertura das Inscrições: 15 de julho de 2021 Valor: R$ 3.000,00 Local: Sede do NIC.br, São Paulo, SP Mais informações sobre os cursos podem ser obtidas na página: https://cert.br/cursos/ Atenciosamente, -- CERT.br/NIC.br <email-anon-83824c64> https://cert.br/ _______________________________________________ certbr-anuncios mailing list email-anon-00f3529c https://listas.cert.br/mailman/listinfo/certbr-anuncios",,30/06/2021 16:12 email-anon-1d555801: <img src='/icons/progresstrail.mail/16' style='vertical-align: text-bottom' width='16' alt='E-mails enviados'></img> 00. Registro - Notificação ao Solicitante,"<iframe width=""100%"" height=""100%"" style=""border: 0;"" src='/services/affiliation-frontend-v1/#/incidentMemofield?id=25c5f5bd-b894-4eb5-8513-6b38a4c0a725&lang=pt-BR'></iframe>"
Chamado de 1º nível,Fechado,RNP2021-056046,CERT.br,Desfiguracao de website (reitoria.ufpel.tche.br),False,2021-08-19 09:30:00,,Clientes,Incidente,Fechado,POP::RS::CERT-RS,True,True,,Segurança,CSIRT,,False,,POP::RS::CERT-RS,,"19/08/2021 08:37 CERT.br: Data de envio: Aug 19, 2021 8:34 AM Para: email-anon-cd4170fe, email-anon-f6f70863, email-anon-d5e24eee CC: email-anon-83824c64 Assunto: Desfiguracao de website (reitoria.ufpel.tche.br) Senhores, Chegou ao nosso conhecimento que o website abaixo teve o seu conteudo alterado. Ressaltamos que no momento o conteudo alterado continua acessivel. URL: http://reitoria.ufpel.tche.br/portarias/arquivos/66.html --begin online content (Thu Aug 19 11:34:37 GMT 2021) -- ,----------------, ,---------, ,-----------------------, ,"" ,""| ,"" ,""| ,"" ,"" | +-----------------------+ | ,"" ,"" | | .-----------------. | | +---------+ | | | | | | | -==----'| | | | little error | | | | | | | | :( | | |/----|`---= | | | | C:\>_ | | | ,/|==== ooo | ; | | | | | // |(((( [33]| ,"" ----end online content-- Solicitamos que o incidente seja investigado e que as acoes cabiveis sejam tomadas. Atenciosamente, -- CERT.br/NIC.br <email-anon-83824c64> https://www.cert.br/",25/08/2021 09:47 Diego Torres: Os responsáveis foram notificados.,19/08/2021 08:39 email-anon-1d555801: <img src='/icons/progresstrail.mail/16' style='vertical-align: text-bottom' width='16' alt='E-mails enviados'></img> 00. Registro - Notifica&ccedil;&atilde;o ao Solicitante 19/08/2021 08:38 email-anon-1d555801: <img src='/icons/progresstrail.mail/16' style='vertical-align: text-bottom' width='16' alt='E-mails enviados'></img> Notificação de Fila - Novo Chamado,"<iframe width=""100%"" height=""100%"" style=""border: 0;"" src='/services/affiliation-frontend-v1/#/incidentMemofield?id=b7d46dd8-414a-4f83-8347-53259a23d22a&lang=pt-BR'></iframe>"
Chamado de 1º nível,Fechado,RNP2021-056583,CERT.br,Desfiguracao de website (dados.unipampa.edu.br),False,2021-08-20 11:13:00,,Clientes,Incidente,Fechado,POP::RS::CERT-RS,True,True,,Segurança,CSIRT,,False,,POP::RS::CERT-RS,,"20/08/2021 10:43 CERT.br: Data de envio: Aug 20, 2021 10:38 AM Para: email-anon-f6f70863, email-anon-562ef188, email-anon-efd77692, email-anon-fbdec9ee CC: email-anon-83824c64 Assunto: Desfiguracao de website (dados.unipampa.edu.br) Senhores, Chegou ao nosso conhecimento que o website abaixo teve o seu conteudo alterado. Ressaltamos que no momento o conteudo alterado continua acessivel. URL: https://dados.unipampa.edu.br/uploads/user/2021-08-15-223051.851148kingskrupellos.html --begin online content (Fri Aug 20 13:38:35 GMT 2021) -- Hacked By KingSkrupellos Cyberizm.Org Digital Security Technological Turkish Muslim Army turk-bayragi2 turk-bayragi [EyP7yD.gif] How Happy is the one who says I am Turkish. ----end online content-- Solicitamos que o incidente seja investigado e que as acoes cabiveis sejam tomadas. Atenciosamente, -- CERT.br/NIC.br <email-anon-83824c64> https://www.cert.br/",25/08/2021 09:47 Diego Torres: Os responsáveis foram notificados.,20/08/2021 10:44 email-anon-1d555801: <img src='/icons/progresstrail.mail/16' style='vertical-align: text-bottom' width='16' alt='E-mails enviados'></img> 00. Registro - Notifica&ccedil;&atilde;o ao Solicitante 20/08/2021 10:43 email-anon-1d555801: <img src='/icons/progresstrail.mail/16' style='vertical-align: text-bottom' width='16' alt='E-mails enviados'></img> Notificação de Fila - Novo Chamado,"<iframe width=""100%"" height=""100%"" style=""border: 0;"" src='/services/affiliation-frontend-v1/#/incidentMemofield?id=92ee5f4a-994f-422c-9afa-44211832a6e4&lang=pt-BR'></iframe>"
Chamado de 1º nível,Fechado,RNP2021-057597,CERT.br,Desfiguracao de website (www2.ufpel.tche.br),False,2021-08-23 14:41:00,,Clientes,Incidente,Fechado,POP::RS::CERT-RS,True,True,,Segurança,CSIRT,,False,,POP::RS::CERT-RS,,"23/08/2021 14:11 CERT.br: Data de envio: Aug 23, 2021 2:07 PM Para: email-anon-f6f70863, email-anon-d5e24eee CC: email-anon-83824c64 Assunto: Desfiguracao de website (www2.ufpel.tche.br) Senhores, Chegou ao nosso conhecimento que o website abaixo teve o seu conteudo alterado. Ressaltamos que no momento o conteudo alterado continua acessivel. URL: http://www2.ufpel.tche.br/prograu/ --begin online content (Mon Aug 23 17:07:17 GMT 2021) -- IFRAME: https://www.youtube.com/embed/9rwE8KeiezE?autoplay=1 Hacked by theMx0nday [skull-dancing.gif] vcs foram ownados suas vadias 3:) somos: son1x777, bky_992 & xtdins1x ----end online content-- Solicitamos que o incidente seja investigado e que as acoes cabiveis sejam tomadas. Atenciosamente, -- CERT.br/NIC.br <email-anon-83824c64> https://www.cert.br/",25/08/2021 09:47 Diego Torres: Os responsáveis foram notificados.,23/08/2021 14:13 email-anon-1d555801: <img src='/icons/progresstrail.mail/16' style='vertical-align: text-bottom' width='16' alt='E-mails enviados'></img> 00. Registro - Notifica&ccedil;&atilde;o ao Solicitante 23/08/2021 14:12 email-anon-1d555801: <img src='/icons/progresstrail.mail/16' style='vertical-align: text-bottom' width='16' alt='E-mails enviados'></img> Notificação de Fila - Novo Chamado,"<iframe width=""100%"" height=""100%"" style=""border: 0;"" src='/services/affiliation-frontend-v1/#/incidentMemofield?id=b482545b-1b4c-4d98-bc1c-a80149ce2f7e&lang=pt-BR'></iframe>"
Chamado de 1º nível,Fechado,RNP2022-023008,CERT.br,Re: Compromised host used for an attack: ipv4-anon-2a7591fa [~94.0 Mbps],False,2022-03-14 09:31:00,,Clientes,Incidente,Fechado,POP::RS::CERT-RS,True,True,,Segurança,CSIRT,,False,,POP::RS::CERT-RS,,"14/03/2022 09:01 CERT.br: Data de envio: Mar 14, 2022 9:00 AM Para: ""NFOservers.com DDoS notifier"" <email-anon-92a6206f>, email-anon-f6f70863, email-anon-a0a85d70 CC: email-anon-83824c64 Assunto: Re: Compromised host used for an attack: ipv4-anon-2a7591fa [~94.0 Mbps] Hello, CERT.br works as a coordinating team for incidents and abuses related to Brazilian networks. We are listed in the ""remarks"" notes of the Brazilian Whois Server output to receive copies of complaints, but we are not the technical or abuse contact of any network. We are forwarding your email to the proper contacts for this network so they can handle this incident. Original message was attached to this email. Thank you for reporting this incident, -- CERT.br/NIC.br <email-anon-83824c64> https://www.cert.br/ ======================================================================= ----- Original message as text ----- From: NFOservers.com DDoS notifier <email-anon-92a6206f> To: email-anon-83824c64 Subject: Compromised host used for an attack: ipv4-anon-2a7591fa [~94.0 Mbps] Date: Fri, 11 Mar 2022 15:50:24 -0800 Message-ID: <email-anon-f7c3f885> An IP address (ipv4-anon-2a7591fa) under your control appears to have attacked one of our customers as part of a coordinated DDoS botnet. We manually reviewed the captures from this attack and do not believe that your IP address was spoofed, based on the limited number of distinct hosts attacking us, the identicality of many attacking IP addresses to ones we've seen in the past, and the non-random distribution of IP addresses. It is possible that this host is one of the following, from the responses that others have sent us: - A compromised router, such as a D-Link that is running with WAN access enabled; a China Telecom which still allows a default admin username and password; a Netis, with a built-in internet-accessible backdoor (http://blog.trendmicro.com/trendlabs-security-intelligence/netis-routers-leave-wide-open-backdoor/); or one running an old AirOS version with a vulnerable and exposed administrative interface - An IPTV device that is vulnerable to compromise (such as HTV), either directly through the default firmware or through a trojan downloaded app - A compromised webhost, such as one running a vulnerable version of Drupal (for instance, using the vulnerability discussed at https://groups.drupal.org/security/faq-2018-002), WordPress, phpMyAdmin, or zPanel - A compromised DVR, such as a ""Hikvision"" brand device (ref: http://www.coresecurity.com/advisories/hikvision-ip-cameras-multiple-vulnerabilities) - A compromised IPMI device, such as one made by Supermicro (possibly because it uses the default U/P of ADMIN/ADMIN or because its password was found through an exploit described at http://arstechnica.com/security/2014/06/at-least-32000-servers-broadcast-admin-passwords-in-the-clear-advisory-warns/) - A compromised Xerox-branded device - Some other compromised standalone device - A server with an insecure password that was brute-forced, such as through SSH or RDP - A server running an improperly secured Hadoop installation - A server running a pre-13.10.3 GitLab instance that is vulnerable to CVE-2021-22205 - A compromised Microsoft DNS server (through the July 2020 critical vulnerability) The overall botnet attack was Nx10Gbps in size (with traffic from your host as well as some others) and caused significant packet loss for our clients due to external link saturation. It required an emergency null-route operation on our side to mitigate. Attacks like this are usually made very short, intentionally, so that they are not as noticeable and slip past certain automatic mitigation systems. From your side, you would be able to observe the attack as a burst of traffic that likely saturated the network adapter of the source device for perhaps 30 seconds. Since the source device is a member of a botnet that is being used for many attacks, you will see many other mysterious bursts of outbound traffic, as well. This i",,14/03/2022 09:03 email-anon-1d555801: <img src='/icons/progresstrail.mail/16' style='vertical-align: text-bottom' width='16' alt='E-mails enviados'></img> 00. Registro - Notifica&ccedil;&atilde;o ao Solicitante 14/03/2022 09:02 email-anon-1d555801: <img src='/icons/progresstrail.mail/16' style='vertical-align: text-bottom' width='16' alt='E-mails enviados'></img> Notifica&ccedil;&atilde;o de Fila - Novo Chamado 14/03/2022 09:01 CERT.br: <img src='/icons/progresstrail.attachment/16' style='vertical-align: text-bottom' width='16' alt='Arquivo anexado'></img> original message,"<iframe width=""100%"" height=""100%"" style=""border: 0;"" src='/services/affiliation-frontend-v1/#/incidentMemofield?id=7517547d-94dc-48bb-9eb2-9a21f2002fe0&lang=pt-BR'></iframe>"
Chamado de 1º nível,Fechado,RNP2022-023506,CERT.br,Alerta: [AS 2716] servico mDNS habilitado,False,2022-03-15 09:30:00,,Clientes,Incidente,Fechado,POP::RS::CERT-RS,True,True,,Segurança,CSIRT,,False,,POP::RS::CERT-RS,,"15/03/2022 09:00 CERT.br: Data de envio: Mar 15, 2022 8:58 AM Para: email-anon-f6f70863, email-anon-a0a85d70 CC: email-anon-83824c64 Assunto: Alerta: [AS 2716] servico mDNS habilitado Caro responsável, Os IPs presentes no log abaixo são de servidores sob sua responsabilidade com o serviço mDNS - Multicast DNS (5353/udp) habilitado. Este serviço pode ser abusado para fazer parte de ataques distribuídos de negação de serviço, consumindo recursos da sua rede e impactando terceiros. Lembramos que os endereços IP listados também podem ser dispositivos de rede com o serviço mDNS habilitado, como roteadores, CPEs (modem ou roteador de uso doméstico instalado nos clientes), impressoras, dispositivos para streaming de mídia, entre outros. Gostaríamos de solicitar que: * o serviço mDNS seja acessível apenas à sua rede local, ou que desabilite o serviço no equipamento, caso nao esteja em uso. Uma descrição do problema e possíveis soluções podem ser encontradas no final deste documento. Se você não for a pessoa correta para corrigir o problema destes equipamentos com o serviço mDNS habilitado, por favor repasse essa mensagem para alguém de sua organização que possa fazê-lo. O indicador no campo 'Resultados do Teste' indica o tipo de problema testado e significa: * mdns: status/pacotes/bytes, onde status é ""open"", e pacotes/bytes indicam o tamanho da resposta recebida, em pacotes/bytes; ==================================================================================== Endereco IP | ASN | Status | Data do Teste | Resultados do Teste ipv4-anon-0ebcd1b8 | 2716 | OPEN | 2022-03-15T11:30:29Z | mdns: open/1/175 ipv4-anon-cd35c16e | 2716 | OPEN | 2022-03-15T11:30:29Z | mdns: open/1/188 ==================================================================================== Mais detalhes sobre o porque do envio desta mensagem, quem é o CERT.br e como resolver este problema estao listados abaixo. Cordialmente, -- CERT.br <email-anon-83824c64> https://www.cert.br/ * O que é o serviço mDNS (5353/udp)? O mDNS (Multicast DNS) é um protocolo de rede utilizado para a resolução de nomes em redes locais que não possuem um servidor DNS próprio. Por se tratar de um serviço utilizado apenas dentro de redes locais, não é necessário que o serviço mDNS esteja exposto à Internet. Caso esteja acessível a toda a Internet via UDP, esse serviço pode ser explorado para ataques DDoS que usem amplificação. Isto ocorre porque o atacante envia uma requisição forjando o IP da vítima e o servidor com mDNS retorna uma resposta muito maior que a requisição. * Por que devo me preocupar com isso? O serviço mDNS pode ser abusado para causar danos a terceiros, envolvendo sua rede em ataques a outras organizações, além de implicar em um consumo de banda maior. Informações adicionais sobre como evitar que sua rede seja abusada para este e outros ataques DDoS podem ser econtradas aqui: https://www.cert.br/docs/whitepapers/ddos/ * Como faço para corrigir o problema? Se o serviço mDNS não for utilizado na sua rede desabilite o serviço no seu dispositivo. Se o recurso for necessário em sua rede, configure-o de modo que esteja disponível apenas para a rede local. * Onde posso obter informações adicionais sobre o abuso do protocolo mDNS para ataques DDoS? - UDP-Based Amplification Attacks https://www.us-cert.gov/ncas/alerts/TA14-017A * Como o CERT.br sabe que este é um dispositivo vulnerável? O CERT.br está recebendo notificações com listas de dispositivos que usam mDNS que possivelmente estão sendo abusados e utilizados em ataques distribuídos de negação de servidos (DDoS). O CERT.br está notificando os responsáveis pelos dispositivos brasileiros presentes nestas listas. * Como posso ter certeza que resolvi o problema? Você pode verificar seu dispositivo através do seguinte comando: (preferencialmente execute-o a partir da Internet, ou seja, fora de uma rede interna que tenha permissão de acesso ao dispo",,15/03/2022 09:02 email-anon-1d555801: <img src='/icons/progresstrail.mail/16' style='vertical-align: text-bottom' width='16' alt='E-mails enviados'></img> 00. Registro - Notifica&ccedil;&atilde;o ao Solicitante 15/03/2022 09:01 email-anon-1d555801: <img src='/icons/progresstrail.mail/16' style='vertical-align: text-bottom' width='16' alt='E-mails enviados'></img> Notificação de Fila - Novo Chamado,"<iframe width=""100%"" height=""100%"" style=""border: 0;"" src='/services/affiliation-frontend-v1/#/incidentMemofield?id=5f71bddf-7163-4d4f-8f4e-14c0df6d2e46&lang=pt-BR'></iframe>"
Chamado de 1º nível,Fechado,RNP2022-023955,CERT.br,Alerta: [AS 2716] servico Portmap habilitado,False,2022-03-16 10:06:00,,Clientes,Incidente,Fechado,POP::RS::CERT-RS,True,True,,Segurança,CSIRT,,False,,POP::RS::CERT-RS,,"16/03/2022 09:36 CERT.br: Data de envio: Mar 16, 2022 9:33 AM Para: email-anon-f6f70863, email-anon-a0a85d70 CC: email-anon-83824c64 Assunto: Alerta: [AS 2716] servico Portmap habilitado Caro responsável, Os IPs presentes no log abaixo são de servidores sob sua responsabilidade com o serviço Portmap (111/udp) habilitado. Este serviço pode ser abusado para fazer parte de ataques distribuídos de negação de serviço, consumindo recursos da sua rede e impactando terceiros, além de poder revelar informações sensíveis armazenadas neste equipamento. Gostaríamos de solicitar que: * o serviço Portmap seja acessível apenas à sua rede local, ou que desabilite o serviço no equipamento, caso ele não esteja em uso. Uma descrição do problema e possíveis soluções podem ser encontradas no final deste documento. Se você nao for a pessoa correta para corrigir o problema destes servidores com o serviço Portmap habilitado, por favor repasse essa mensagem para alguém de sua organização que possa fazê-lo. O indicador no campo 'Resultados do Teste' indica o tipo de problema testado e significa: * portmap: status/pacotes/bytes, onde status é ""open"", e pacotes/bytes indicam o tamanho da resposta recebida, em pacotes/bytes; ==================================================================================== Endereco IP | ASN | Status | Data do Teste | Resultados do Teste ipv4-anon-2f477aeb | 2716 | OPEN | 2022-03-16T11:39:05Z | portmap: open/1/488 ipv4-anon-d87d80d0 | 2716 | OPEN | 2022-03-16T11:39:05Z | portmap: open/1/188 ipv4-anon-e665e55e | 2716 | OPEN | 2022-03-16T11:39:05Z | portmap: open/1/488 ipv4-anon-2503ca55 | 2716 | OPEN | 2022-03-16T11:39:05Z | portmap: open/1/468 ipv4-anon-9bbaf3a5 | 2716 | OPEN | 2022-03-16T11:39:05Z | portmap: open/1/488 ==================================================================================== Mais detalhes sobre o porque do envio desta mensagem, quem é o CERT.br e como resolver este problema estão listados abaixo. Cordialmente, -- CERT.br <email-anon-83824c64> https://www.cert.br/ * O que é o serviço Portmap (111/udp)? O servico Portmap, também chamado de Portmapper ou rpcbind, é utilizado para mapear serviços RPC na rede, como NIS e NFS. Esse serviço geralmente é utilizado por sistemas Unix, especialmente para compartilhamento de arquivos, além de outros serviços. Por se tratar de um serviço geralmente utilizado apenas dentro de redes locais, é muito provável que não exista necessidade do serviço Portmap estar exposto à Internet. Caso esteja acessível a toda a Internet via UDP, esse serviço pode ser explorado para ataques DDoS que usem amplificação. Isto ocorre porque o atacante envia uma requisição forjando o IP da vítima e o servidor com Portmap retorna uma resposta muito maior que a requisição. * Por que devo me preocupar com isso? O Portmap pode ser abusado para causar danos a terceiros, envolvendo sua rede em ataques a outras organizações e implicando em um consumo de banda maior. Além dessas implicações, esse serviço pode revelar informações sensíveis sobre sua rede e seus dados armazenados. Informações adicionais sobre como evitar que sua rede seja abusada para ataques DDoS podem ser encontradas aqui: https://www.cert.br/docs/whitepapers/ddos/ * Como faço para corrigir o problema? Configure o serviço Portmap de forma que ele seja acessível somente aos dispositivos de sua rede, que utilizem esse serviço, ou que ele seja acessível apenas via TCP. Caso o serviço Portmap seja desnecessário nesse servidor, recomendamos que ele seja desativado. * Onde posso obter informações adicionais sobre o abuso do protocolo Portmap para ataques DDoS? - UDP-Based Amplification Attacks https://www.us-cert.gov/ncas/alerts/TA14-017A - Openly accessible Portmapper services https://www.bsi.bund.de/EN/Topics/IT-Crisis-Management/CERT-Bund/CERT-Reports/HOWTOs/Open-Portmapper-Services/open-Portmapper-services_node.html * Como o CERT.br sabe",,16/03/2022 09:38 email-anon-1d555801: <img src='/icons/progresstrail.mail/16' style='vertical-align: text-bottom' width='16' alt='E-mails enviados'></img> 00. Registro - Notifica&ccedil;&atilde;o ao Solicitante 16/03/2022 09:37 email-anon-1d555801: <img src='/icons/progresstrail.mail/16' style='vertical-align: text-bottom' width='16' alt='E-mails enviados'></img> Notificação de Fila - Novo Chamado,"<iframe width=""100%"" height=""100%"" style=""border: 0;"" src='/services/affiliation-frontend-v1/#/incidentMemofield?id=158753e8-3686-4366-8b43-a7817656f223&lang=pt-BR'></iframe>"
